{
  "record_id": "SIM-900003",
  "schema_version": "1.0.0",
  "category": "simulation",
  "source": {
    "kind": "publication",
    "doi": "10.1371/journal.pcbi.1005211",
    "title": "As Simple As Possible, but Not Simpler: Exploring the Fidelity of Coarse-Grained Protein Models for Simulated Force Spectroscopy",
    "journal": "PLoS Computational Biology",
    "year": 2016,
    "url": "https://doi.org/10.1371/journal.pcbi.1005211",
    "retrieved": "2026-10-11",
    "evidence": [
      {"field": "source.doi", "method": "manual_curation", "confidence": "high",
       "snippet": "Habibi, Rottler & Plotkin, PLoS Comput Biol 12:e1005211 (2016)"}
    ]
  },
  "system": {
    "molecule_type": "protein",
    "name": "Single-domain model protein (heavy-atom Go)",
    "structure_source": "PDB",
    "evidence": [
      {"field": "system.name", "method": "manual_curation", "confidence": "medium",
       "snippet": "heavy-atom Go models of single-domain proteins pulled in LAMMPS"}
    ]
  },
  "model": {
    "family": "Go_heavy_atom",
    "family_group": "protein",
    "solvent": "implicit",
    "software": [{"name": "LAMMPS"}],
    "unit_system": "reduced",
    "evidence": [
      {"field": "model.family", "method": "manual_curation", "confidence": "high",
       "snippet": "heavy-atom Go model compared with the C-alpha model"}
    ]
  },
  "protocol": {
    "mode": "constant_velocity",
    "geometry": {
      "force_application_geometry": "other",
      "description": "harmonic pulling force applied to one terminus",
      "anchor_a": {"description": "fixed terminus", "end": "N_terminus"},
      "anchor_b": {"description": "pulled terminus", "end": "C_terminus"}
    },
    "evidence": [
      {"field": "protocol.mode", "method": "manual_curation", "confidence": "medium",
       "snippet": "constant-velocity pulling in LAMMPS"}
    ]
  },
  "results": [
    {"quantity": "unfolding_force", "value": 4.5, "unit": "epsilon/sigma",
     "unit_system": "reduced",
     "provenance": [{"field": "results[0]", "method": "manual_curation", "confidence": "low",
                     "snippet": "illustrative reduced-unit value for schema validation"}]},
    {"quantity": "molecular_stiffness", "value": 30, "unit": "epsilon/sigma2",
     "unit_system": "reduced",
     "provenance": [{"field": "results[1]", "method": "manual_curation", "confidence": "low",
                     "snippet": "illustrative reduced-unit value for schema validation"}]}
  ],
  "data_availability": {
    "status": "not_stated",
    "has_linked_dataset": false,
    "input_files": {"available": false, "statement": "not stated"}
  },
  "curation": {
    "status": "manually_reviewed",
    "curator": "schema-example",
    "date": "2026-10-11",
    "notes": "Hand-made example for schema validation, not a corpus record. It exists to exercise the reduced-unit path: no conversion is claimed because the paper reports reduced units."
  },
  "fair_completeness": {
    "publication": 0.667, "system": 0.5, "model": 0.6, "protocol": 0.333,
    "results": 1.0, "data": 0.0, "overall": 0.517
  }
}